{
  "schema_version": "location-scenarios.v1",
  "test_parameters": {
    "interval_seconds": 30,
    "accuracy_metres": 5
  },
  "reference_polygon": {
    "type": "Polygon",
    "coordinates": [
      [
        [
          -114.01,
          50.99
        ],
        [
          -113.99,
          50.99
        ],
        [
          -113.99,
          51.01
        ],
        [
          -114.01,
          51.01
        ],
        [
          -114.01,
          50.99
        ]
      ]
    ]
  },
  "cases": [
    {
      "name": "inside",
      "binding": {
        "schema_version": "location-binding.v1",
        "uuid": "00000000-0000-4000-8000-000000000001",
        "revision": 1,
        "organization_uuid": "00000000-0000-4000-8000-000000000002",
        "device_uuid": "00000000-0000-4000-8000-000000000003",
        "configuration_uuid": "00000000-0000-4000-8000-000000000004",
        "generation": 1,
        "latitude_parameter_uuid": "00000000-0000-4000-8000-000000000005",
        "longitude_parameter_uuid": "00000000-0000-4000-8000-000000000006",
        "accuracy_parameter_uuid": "00000000-0000-4000-8000-000000000007",
        "pairing": "same_event",
        "max_age_seconds": 90,
        "max_future_skew_seconds": 5,
        "allow_unknown_accuracy": true
      },
      "event": {
        "schema_version": "telemetry.committed.v1",
        "event_id": "00000000-0000-4000-8000-000000000065",
        "telemetry_id": "00000000-0000-4000-8000-000000000065",
        "sequence": "1",
        "organization_uuid": "00000000-0000-4000-8000-000000000002",
        "device_uuid": "00000000-0000-4000-8000-000000000003",
        "configuration_uuid": "00000000-0000-4000-8000-000000000004",
        "generation": 1,
        "readings": [
          {
            "parameter_uuid": "00000000-0000-4000-8000-000000000005",
            "key": "location.latitude",
            "data_type": "number",
            "unit": "deg",
            "value": 51.0,
            "quality": "good",
            "observed_at": "2026-09-25T00:00:30Z",
            "received_at": "2026-09-25T00:00:31Z",
            "timestamp_source": "source",
            "historical": false
          },
          {
            "parameter_uuid": "00000000-0000-4000-8000-000000000006",
            "key": "location.longitude",
            "data_type": "number",
            "unit": "deg",
            "value": -114.0,
            "quality": "good",
            "observed_at": "2026-09-25T00:00:30Z",
            "received_at": "2026-09-25T00:00:31Z",
            "timestamp_source": "source",
            "historical": false
          },
          {
            "parameter_uuid": "00000000-0000-4000-8000-000000000007",
            "key": "location.accuracy",
            "data_type": "number",
            "unit": "m",
            "value": 5,
            "quality": "good",
            "observed_at": "2026-09-25T00:00:30Z",
            "received_at": "2026-09-25T00:00:31Z",
            "timestamp_source": "source",
            "historical": false
          }
        ]
      },
      "evaluated_at": "2026-09-25T00:00:32Z",
      "expected": {
        "status": "valid",
        "reason": "eligible",
        "live_eligible": true
      }
    },
    {
      "name": "outside",
      "binding": {
        "schema_version": "location-binding.v1",
        "uuid": "00000000-0000-4000-8000-000000000001",
        "revision": 1,
        "organization_uuid": "00000000-0000-4000-8000-000000000002",
        "device_uuid": "00000000-0000-4000-8000-000000000003",
        "configuration_uuid": "00000000-0000-4000-8000-000000000004",
        "generation": 1,
        "latitude_parameter_uuid": "00000000-0000-4000-8000-000000000005",
        "longitude_parameter_uuid": "00000000-0000-4000-8000-000000000006",
        "accuracy_parameter_uuid": "00000000-0000-4000-8000-000000000007",
        "pairing": "same_event",
        "max_age_seconds": 90,
        "max_future_skew_seconds": 5,
        "allow_unknown_accuracy": true
      },
      "event": {
        "schema_version": "telemetry.committed.v1",
        "event_id": "00000000-0000-4000-8000-000000000066",
        "telemetry_id": "00000000-0000-4000-8000-000000000066",
        "sequence": "2",
        "organization_uuid": "00000000-0000-4000-8000-000000000002",
        "device_uuid": "00000000-0000-4000-8000-000000000003",
        "configuration_uuid": "00000000-0000-4000-8000-000000000004",
        "generation": 1,
        "readings": [
          {
            "parameter_uuid": "00000000-0000-4000-8000-000000000005",
            "key": "location.latitude",
            "data_type": "number",
            "unit": "deg",
            "value": 51.02,
            "quality": "good",
            "observed_at": "2026-09-25T00:01:00Z",
            "received_at": "2026-09-25T00:01:01Z",
            "timestamp_source": "source",
            "historical": false
          },
          {
            "parameter_uuid": "00000000-0000-4000-8000-000000000006",
            "key": "location.longitude",
            "data_type": "number",
            "unit": "deg",
            "value": -114.0,
            "quality": "good",
            "observed_at": "2026-09-25T00:01:00Z",
            "received_at": "2026-09-25T00:01:01Z",
            "timestamp_source": "source",
            "historical": false
          },
          {
            "parameter_uuid": "00000000-0000-4000-8000-000000000007",
            "key": "location.accuracy",
            "data_type": "number",
            "unit": "m",
            "value": 5,
            "quality": "good",
            "observed_at": "2026-09-25T00:01:00Z",
            "received_at": "2026-09-25T00:01:01Z",
            "timestamp_source": "source",
            "historical": false
          }
        ]
      },
      "evaluated_at": "2026-09-25T00:01:02Z",
      "expected": {
        "status": "valid",
        "reason": "eligible",
        "live_eligible": true
      }
    },
    {
      "name": "boundary",
      "binding": {
        "schema_version": "location-binding.v1",
        "uuid": "00000000-0000-4000-8000-000000000001",
        "revision": 1,
        "organization_uuid": "00000000-0000-4000-8000-000000000002",
        "device_uuid": "00000000-0000-4000-8000-000000000003",
        "configuration_uuid": "00000000-0000-4000-8000-000000000004",
        "generation": 1,
        "latitude_parameter_uuid": "00000000-0000-4000-8000-000000000005",
        "longitude_parameter_uuid": "00000000-0000-4000-8000-000000000006",
        "accuracy_parameter_uuid": "00000000-0000-4000-8000-000000000007",
        "pairing": "same_event",
        "max_age_seconds": 90,
        "max_future_skew_seconds": 5,
        "allow_unknown_accuracy": true
      },
      "event": {
        "schema_version": "telemetry.committed.v1",
        "event_id": "00000000-0000-4000-8000-000000000067",
        "telemetry_id": "00000000-0000-4000-8000-000000000067",
        "sequence": "3",
        "organization_uuid": "00000000-0000-4000-8000-000000000002",
        "device_uuid": "00000000-0000-4000-8000-000000000003",
        "configuration_uuid": "00000000-0000-4000-8000-000000000004",
        "generation": 1,
        "readings": [
          {
            "parameter_uuid": "00000000-0000-4000-8000-000000000005",
            "key": "location.latitude",
            "data_type": "number",
            "unit": "deg",
            "value": 51.01,
            "quality": "good",
            "observed_at": "2026-09-25T00:01:30Z",
            "received_at": "2026-09-25T00:01:31Z",
            "timestamp_source": "source",
            "historical": false
          },
          {
            "parameter_uuid": "00000000-0000-4000-8000-000000000006",
            "key": "location.longitude",
            "data_type": "number",
            "unit": "deg",
            "value": -114.0,
            "quality": "good",
            "observed_at": "2026-09-25T00:01:30Z",
            "received_at": "2026-09-25T00:01:31Z",
            "timestamp_source": "source",
            "historical": false
          },
          {
            "parameter_uuid": "00000000-0000-4000-8000-000000000007",
            "key": "location.accuracy",
            "data_type": "number",
            "unit": "m",
            "value": 5,
            "quality": "good",
            "observed_at": "2026-09-25T00:01:30Z",
            "received_at": "2026-09-25T00:01:31Z",
            "timestamp_source": "source",
            "historical": false
          }
        ]
      },
      "evaluated_at": "2026-09-25T00:01:32Z",
      "expected": {
        "status": "valid",
        "reason": "eligible",
        "live_eligible": true
      }
    },
    {
      "name": "jitter_inside",
      "binding": {
        "schema_version": "location-binding.v1",
        "uuid": "00000000-0000-4000-8000-000000000001",
        "revision": 1,
        "organization_uuid": "00000000-0000-4000-8000-000000000002",
        "device_uuid": "00000000-0000-4000-8000-000000000003",
        "configuration_uuid": "00000000-0000-4000-8000-000000000004",
        "generation": 1,
        "latitude_parameter_uuid": "00000000-0000-4000-8000-000000000005",
        "longitude_parameter_uuid": "00000000-0000-4000-8000-000000000006",
        "accuracy_parameter_uuid": "00000000-0000-4000-8000-000000000007",
        "pairing": "same_event",
        "max_age_seconds": 90,
        "max_future_skew_seconds": 5,
        "allow_unknown_accuracy": true
      },
      "event": {
        "schema_version": "telemetry.committed.v1",
        "event_id": "00000000-0000-4000-8000-000000000068",
        "telemetry_id": "00000000-0000-4000-8000-000000000068",
        "sequence": "4",
        "organization_uuid": "00000000-0000-4000-8000-000000000002",
        "device_uuid": "00000000-0000-4000-8000-000000000003",
        "configuration_uuid": "00000000-0000-4000-8000-000000000004",
        "generation": 1,
        "readings": [
          {